<olympics xmlns:xsi="http://www.w3.org/2001/XMLSchema-instance"
          xsi:noNamespaceSchemaLocation="olympics.xsd">
    <sports>
        <sport>
            <id>1</id>
            <sportType>
                <id>1</id>
                <name>SportType1</name>
                <isIndividual>true</isIndividual>
            </sportType>
            <name>Sport1</name>
            <description>Description1</description>
        </sport>
        <sport>
            <id>2</id>
            <sportType>
                <id>2</id>
                <name>SportType2</name>
                <isIndividual>false</isIndividual>
            </sportType>
            <name>Sport2</name>
            <description>Description2</description>
        </sport>
    </sports>
    <teams>
        <team>
            <id>1</id>
            <country>
                <id>1</id>
                <countryName>Country1</countryName>
            </country>
            <captain>
                <participant>
                    <id>1</id>
                    <country>
                        <id>1</id>
                        <countryName>Country1</countryName>
                    </country>
                    <sport>
                        <id>1</id>
                        <sportType>
                            <id>1</id>
                            <name>SportType1</name>
                            <isIndividual>true</isIndividual>
                        </sportType>
                        <name>Sport1</name>
                        <description>Description1</description>
                    </sport>
                    <pname>Participant1</pname>
                    <surname>Surname1</surname>
                    <birthdate>2000-01-01</birthdate>
                    <gender>Male</gender>
                    <email>participant1@example.com</email>
                    <individualScoreList>
                        <individualScore>
                            <id>1</id>
                            <time>10:10:10</time>
                            <points>2</points>
                            <distance>0.0</distance>
                        </individualScore>
                        <individualScore>
                            <id>2</id>
                            <time>00:00:00</time>
                            <points>4</points>
                            <distance>0.0</distance>
                        </individualScore>
                    </individualScoreList>
                </participant>
            </captain>
            <teamName>Team1</teamName>
            <squadSize>20</squadSize>
            <players>
                <participant>
                    <id>1</id>
                    <country>
                        <id>1</id>
                        <countryName>Country1</countryName>
                    </country>
                    <sport>
                        <id>1</id>
                        <sportType>
                            <id>1</id>
                            <name>SportType1</name>
                            <isIndividual>true</isIndividual>
                        </sportType>
                        <name>Sport1</name>
                        <description>Description1</description>
                    </sport>
                    <pname>Participant1</pname>
                    <surname>Surname1</surname>
                    <birthdate>2000-01-01</birthdate>
                    <gender>Male</gender>
                    <email>participant1@example.com</email>
                    <individualScoreList>
                        <individualScore>
                            <id>1</id>
                            <time>00:00:00</time>
                            <points>2</points>
                            <distance>0.0</distance>
                        </individualScore>
                        <individualScore>
                            <id>2</id>
                            <time>01:01:01</time>
                            <points>4</points>
                            <distance>0.0</distance>
                        </individualScore>
                    </individualScoreList>
                </participant>
                <participant>
                    <id>2</id>
                    <country>
                        <id>2</id>
                        <countryName>Country2</countryName>
                    </country>
                    <sport>
                        <id>2</id>
                        <sportType>
                            <id>2</id>
                            <name>SportType2</name>
                            <isIndividual>false</isIndividual>
                        </sportType>
                        <name>Sport2</name>
                        <description>Description2</description>
                    </sport>
                    <pname>Participant2</pname>
                    <surname>Surname2</surname>
                    <birthdate>1995-05-15</birthdate>
                    <gender>Female</gender>
                    <email>participant2@example.com</email>
                    <individualScoreList>
                        <individualScore>
                            <id>3</id>
                            <time>02:02:20</time>
                            <points>3</points>
                            <distance>0.0</distance>
                        </individualScore>
                        <individualScore>
                            <id>4</id>
                            <time>02:02:02</time>
                            <points>5</points>
                            <distance>0.0</distance>
                        </individualScore>
                    </individualScoreList>
                </participant>
            </players>
            <teamScoreList>
                <teamScore>
                    <id>1</id>
                    <teamPoints>100</teamPoints>
                    <teamTime>00:15:30</teamTime>
                </teamScore>
                <teamScore>
                    <id>2</id>
                    <teamPoints>75</teamPoints>
                    <teamTime>00:20:45</teamTime>
                </teamScore>
            </teamScoreList>
        </team>
    </teams>
</olympics>